{
  "artifacts": [
    {
      "kind": "file",
      "path": "docs/phase-1.md"
    }
  ],
  "blockers": [],
  "changed_files": [
    "docs/phase-1.md"
  ],
  "completed_work_units": [],
  "decisions": [
    "Kept the change scoped to the phase documentation."
  ],
  "do_not_retry": [],
  "next_phase_context": [
    "Phase 2 can build on docs/phase-1.md."
  ],
  "open_items": [],
  "phase_attempt": 1,
  "phase_id": "1",
  "run_id": "01ARZ3NDEKTSV4RRFFQ69G5FAV",
  "schema_version": 1,
  "status": "complete",
  "summary": "Phase 1 completed successfully.",
  "validation_summary": [
    "Unit tests passed."
  ],
  "written_at": "2026-04-29T18:08:30Z"
}
